[
 {
  "__type": "Svenskfotboll.Fogis.Web.FogisMobilDomarKlient.MatchJSON",
  "value": "990002001",
  "label": "990002001: Lag I IK - Lag J FF (Serie 3), 2024-09-24 19:00",
  "matchid": 91000066,
  "matchnr": "990002001",
  "fotbollstypid": 2,
  "matchlag1id": 92000165,
  "lag1lagengagemangid": 9500199,
  "lag1lagid": 930361,
  "lag1foreningid": 94184,
  "lag1forbundid": 0,
  "lag1namn": "Lag I IK",
  "lag1spelsystem": "",
  "matchlag2id": 92000242,
  "lag2lagengagemangid": 9500251,
  "lag2lagid": 930362,
  "lag2foreningid": 94201,
  "lag2forbundid": 0,
  "lag2namn": "Lag J FF",
  "lag2spelsystem": "",
  "anlaggningid": 98062,
  "anlaggningnamn": "Spelplats 3 ",
  "anlaggningLatitud": -1.7976931348623157e+308,
  "anlaggningLongitud": -1.7976931348623157e+308,
  "tid": "/Date(1727197200000)/",
  "speldatum": "2024-09-24",
  "avsparkstid": "19:00",
  "tidsangivelse": "2024-09-24, 19:00",
  "tavlingid": 960146,
  "tavlingnr": "990002",
  "tavlingnamn": "Serie 3",
  "tavlingskategoriid": 97083,
  "tavlingskategorinamn": "Kategori 2",
  "tavlingagsavforbundid": 102,
  "matchlag1mal": 2,
  "matchlag2mal": 4,
  "arslutresultat": true,
  "wo": false,
  "ow": false,
  "ww": false,
  "antalaskadare": 70,
  "uppskjuten": false,
  "avbruten": false,
  "installd": false,
  "matchrapportgodkandavdomare": true,
  "matchrapportgodkandavdomaredatum": "/Date(1727211738287)/",
  "matchrapportgodkandavdomaredatumformaterad": "2024-09-24 23:02:18",
  "tavlinganvanderhogupplosttid": false,
  "tavlingantalstartadespelareigodkanddomarrapport": 5,
  "tavlingmaxantalspelareimatchtruppigodkanddomarrapport": 14,
  "tavlingantalledareimatchtrupp": 6,
  "tavlingantalspelareimatchtrupp": 14,
  "antalhalvlekar": 2,
  "tidperhalvlek": 20,
  "antalforlangningsperioder": 0,
  "tidperforlangningsperiod": 0,
  "liverapporteringTillaten": true,
  "liverapporteringPaborjad": false,
  "liverapporteringAvslutad": false,
  "liverapporteringsAktorTypId": 2,
  "anvanderspelarleg": false,
  "foreningsanvandarefarredigeramotstandartrupp": true,
  "foreningsanvandarefarregistreramatchhandelser": false,
  "foreningsanvandarefarregistreramatchresultat": false,
  "domaruppdraglista": [
   {
    "domaruppdragid": 86000362,
    "matchid": 91000066,
    "matchnr": "990002001",
    "domarrollid": 1,
    "domarrollnamn": "Förstedomare",
    "domarrollkortnamn": "Dom 1",
    "domareid": 82269,
    "domarnr": "970006",
    "personid": 8101162,
    "domaruppdragstatusid": 5,
    "domaruppdragstatusnamn": "Tilldelat",
    "personnamn": "Botvid Hedmo",
    "namn": "Botvid Hedmo"
   },
   {
    "domaruppdragid": 86000411,
    "matchid": 91000066,
    "matchnr": "990002001",
    "domarrollid": 2,
    "domarrollnamn": "Andredomare",
    "domarrollkortnamn": "Dom 2",
    "domareid": 82303,
    "domarnr": "970007",
    "personid": 8101199,
    "domaruppdragstatusid": 5,
    "domaruppdragstatusnamn": "Tilldelat",
    "personnamn": "Judit Lindhage",
    "namn": "Judit Lindhage"
   },
   {
    "domaruppdragid": 86000454,
    "matchid": 91000066,
    "matchnr": "990002001",
    "domarrollid": 3,
    "domarrollnamn": "Tredjedomare",
    "domarrollkortnamn": "Dom 3",
    "domareid": 82132,
    "domarnr": "970003",
    "personid": 8100163,
    "domaruppdragstatusid": 5,
    "domaruppdragstatusnamn": "Tilldelat",
    "personnamn": "Jorunn Stentuna",
    "namn": "Jorunn Stentuna"
   },
   {
    "domaruppdragid": 86000473,
    "matchid": 91000066,
    "matchnr": "990002001",
    "domarrollid": 5,
    "domarrollnamn": "Domarobservatör",
    "domarrollkortnamn": "Obs",
    "domareid": 82029,
    "domarnr": "970001",
    "personid": 8100017,
    "domaruppdragstatusid": 5,
    "domaruppdragstatusnamn": "Tilldelat",
    "personnamn": "Birgitta Stenstad",
    "namn": "Birgitta Stenstad"
   }
  ],
  "domarefargodkannarapport": false,
  "domarrapporteringTillaten": false,
  "noteringfranlag1": "",
  "noteringfranlag2": "",
  "noteringfrandomare": "",
  "tavlingFriaByten": true,
  "tavlingDomareMojliggorHamtningAvFrammandeSpelareTillMatchtrupp": false,
  "tavlingAntalTimmarInnanMatchForTruppAdministration": 0,
  "tavlingDomareKravForekomstAvAnsvarigLagledareIGodkandDomarrapport": false,
  "tavlingAntalDagarEfterMatchForAdministrationAvDomarrapport": 1,
  "tavlingKonId": 2,
  "tavlingAlderskategori": 4,
  "kontaktpersoner": [
   {
    "lagid": 930361,
    "lagnamn": "Lag I IK",
    "personid": 8101253,
    "personnamn": "Cilla Asktuna",
    "reserv": false,
    "foreningId": 94184
   },
   {
    "lagid": 930362,
    "lagnamn": "Lag K SK",
    "personid": 8101276,
    "personnamn": "Jorunn Tjärnryd",
    "reserv": false,
    "foreningId": 94201
   },
   {
    "lagid": 930362,
    "lagnamn": "Lag K SK",
    "personid": 8101283,
    "personnamn": "Tyra Tjärnudde",
    "reserv": true,
    "foreningId": 94201
   }
  ],
  "matchlag1OffentliggorMatchtruppDatumTid": "/Date(1727193600000)/",
  "matchlag2OffentliggorMatchtruppDatumTid": "/Date(1727193600000)/",
  "tavlingDomareAntalMinuterForeMatchSomTrupperOffentliggors": 60,
  "domareArHuvuddomare": false,
  "tavlingMatchklimatDomareKanLamnaOmdome": false,
  "tavlingDomareVisaVarningsOchAvstangningsAckumulering": true,
  "TavlingTrojnummerKravsIForeningensLaguppstallning": false
 }
]
