[
 {
  "__type": "Svenskfotboll.Fogis.Web.FogisMobilDomarKlient.MatchJSON",
  "value": "990006001",
  "label": "990006001: Lag V FF - Lag W SK (Serie 7), 2014-03-22 18:15",
  "matchid": 91000259,
  "matchnr": "990006001",
  "fotbollstypid": 2,
  "matchlag1id": 92000589,
  "lag1lagengagemangid": 9500531,
  "lag1lagid": 930674,
  "lag1foreningid": 94516,
  "lag1forbundid": 0,
  "lag1namn": "Lag V FF",
  "lag1spelsystem": "",
  "matchlag2id": 92000592,
  "lag2lagengagemangid": 9500595,
  "lag2lagid": 930686,
  "lag2foreningid": 94554,
  "lag2forbundid": 0,
  "lag2namn": "Lag W SK",
  "lag2spelsystem": "",
  "anlaggningid": 98259,
  "anlaggningnamn": "Spelplats 7",
  "anlaggningLatitud": -1.7976931348623157e+308,
  "anlaggningLongitud": -1.7976931348623157e+308,
  "tid": "/Date(1395508500000)/",
  "speldatum": "2014-03-22",
  "avsparkstid": "18:15",
  "tidsangivelse": "2014-03-22, 18:15",
  "tavlingid": 960203,
  "tavlingnr": "990006",
  "tavlingnamn": "Serie 7",
  "tavlingskategoriid": 97156,
  "tavlingskategorinamn": "Kategori 6",
  "tavlingagsavforbundid": 106,
  "matchlag1mal": 9,
  "matchlag2mal": 8,
  "arslutresultat": true,
  "wo": false,
  "ow": false,
  "ww": false,
  "antalaskadare": 380,
  "uppskjuten": false,
  "avbruten": false,
  "installd": false,
  "matchrapportgodkandavdomare": true,
  "matchrapportgodkandavdomaredatum": "/Date(1395786290170)/",
  "matchrapportgodkandavdomaredatumformaterad": "2014-03-25 23:24:50",
  "tavlinganvanderhogupplosttid": false,
  "tavlingantalstartadespelareigodkanddomarrapport": 0,
  "tavlingmaxantalspelareimatchtruppigodkanddomarrapport": 14,
  "tavlingantalledareimatchtrupp": 6,
  "tavlingantalspelareimatchtrupp": 20,
  "antalhalvlekar": 2,
  "tidperhalvlek": 20,
  "antalforlangningsperioder": 2,
  "tidperforlangningsperiod": 5,
  "liverapporteringTillaten": false,
  "liverapporteringPaborjad": false,
  "liverapporteringAvslutad": false,
  "liverapporteringsAktorTypId": 0,
  "anvanderspelarleg": false,
  "foreningsanvandarefarredigeramotstandartrupp": false,
  "foreningsanvandarefarregistreramatchhandelser": false,
  "foreningsanvandarefarregistreramatchresultat": false,
  "domaruppdraglista": [
   {
    "domaruppdragid": 86001167,
    "matchid": 91000259,
    "matchnr": "990006001",
    "domarrollid": 1,
    "domarrollnamn": "Förstedomare",
    "domarrollkortnamn": "Dom 1",
    "domareid": 82029,
    "domarnr": "970001",
    "personid": 8100017,
    "domaruppdragstatusid": 5,
    "domaruppdragstatusnamn": "Tilldelat",
    "personnamn": "Birgitta Stenstad",
    "namn": "Birgitta Stenstad"
   },
   {
    "domaruppdragid": 86001189,
    "matchid": 91000259,
    "matchnr": "990006001",
    "domarrollid": 1,
    "domarrollnamn": "Förstedomare",
    "domarrollkortnamn": "Dom 1",
    "domareid": 82720,
    "domarnr": "970015",
    "personid": 8103209,
    "domaruppdragstatusid": 5,
    "domaruppdragstatusnamn": "Tilldelat",
    "personnamn": "Gideon Bäckfors",
    "namn": "Gideon Bäckfors"
   },
   {
    "domaruppdragid": 86001220,
    "matchid": 91000259,
    "matchnr": "990006001",
    "domarrollid": 1,
    "domarrollnamn": "Förstedomare",
    "domarrollkortnamn": "Dom 1",
    "domareid": 82748,
    "domarnr": "970016",
    "personid": 8103262,
    "domaruppdragstatusid": 5,
    "domaruppdragstatusnamn": "Tilldelat",
    "personnamn": "Gunvald Lönnnäs",
    "namn": "Gunvald Lönnnäs"
   }
  ],
  "domarefargodkannarapport": false,
  "domarrapporteringTillaten": false,
  "noteringfranlag1": "",
  "noteringfranlag2": "",
  "noteringfrandomare": "",
  "tavlingFriaByten": false,
  "tavlingDomareMojliggorHamtningAvFrammandeSpelareTillMatchtrupp": false,
  "tavlingAntalTimmarInnanMatchForTruppAdministration": 0,
  "tavlingDomareKravForekomstAvAnsvarigLagledareIGodkandDomarrapport": false,
  "tavlingAntalDagarEfterMatchForAdministrationAvDomarrapport": 1,
  "tavlingKonId": 2,
  "tavlingAlderskategori": 4,
  "kontaktpersoner": [
   {
    "lagid": 930674,
    "lagnamn": "Lag V FF",
    "personid": 0,
    "personnamn": "Hervor Lövstad",
    "reserv": false,
    "foreningId": 94516
   },
   {
    "lagid": 930686,
    "lagnamn": "Lag X FC",
    "personid": 0,
    "personnamn": "Bengtina Kärrhage",
    "reserv": false,
    "foreningId": 94554
   }
  ],
  "matchlag1OffentliggorMatchtruppDatumTid": "/Date(1395504900000)/",
  "matchlag2OffentliggorMatchtruppDatumTid": "/Date(1395504900000)/",
  "tavlingDomareAntalMinuterForeMatchSomTrupperOffentliggors": 0,
  "domareArHuvuddomare": true,
  "tavlingMatchklimatDomareKanLamnaOmdome": false,
  "tavlingDomareVisaVarningsOchAvstangningsAckumulering": false,
  "TavlingTrojnummerKravsIForeningensLaguppstallning": false
 }
]
