[
 {
  "__type": "Svenskfotboll.Fogis.Web.FogisMobilDomarKlient.MatchJSON",
  "value": "990001002",
  "label": "990001002: Lag E SK - Lag F FC (Serie 2), 2021-12-14 15:00",
  "matchid": 91000056,
  "matchnr": "990001002",
  "fotbollstypid": 1,
  "matchlag1id": 92000092,
  "lag1lagengagemangid": 9500082,
  "lag1lagid": 930240,
  "lag1foreningid": 94098,
  "lag1forbundid": 0,
  "lag1namn": "Lag E SK",
  "lag1spelsystem": "0",
  "matchlag2id": 92000145,
  "lag2lagengagemangid": 9500142,
  "lag2lagid": 930289,
  "lag2foreningid": 94131,
  "lag2forbundid": 0,
  "lag2namn": "Lag F FC",
  "lag2spelsystem": "0",
  "anlaggningid": 98055,
  "anlaggningnamn": "Spelplats 2",
  "anlaggningLatitud": -1.7976931348623157e+308,
  "anlaggningLongitud": -1.7976931348623157e+308,
  "tid": "/Date(1639490400000)/",
  "speldatum": "2021-12-14",
  "avsparkstid": "15:00",
  "tidsangivelse": "2021-12-14, 15:00",
  "tavlingid": 960121,
  "tavlingnr": "990001",
  "tavlingnamn": "Serie 2",
  "tavlingskategoriid": 97064,
  "tavlingskategorinamn": "Kategori 1",
  "tavlingagsavforbundid": 102,
  "matchlag1mal": 1,
  "matchlag2mal": 0,
  "arslutresultat": true,
  "wo": false,
  "ow": false,
  "ww": false,
  "antalaskadare": 0,
  "uppskjuten": false,
  "avbruten": false,
  "installd": false,
  "matchrapportgodkandavdomare": true,
  "matchrapportgodkandavdomaredatum": "/Date(1639498675820)/",
  "matchrapportgodkandavdomaredatumformaterad": "2021-12-14 17:17:55",
  "tavlinganvanderhogupplosttid": false,
  "tavlingantalstartadespelareigodkanddomarrapport": 11,
  "tavlingmaxantalspelareimatchtruppigodkanddomarrapport": 18,
  "tavlingantalledareimatchtrupp": 7,
  "tavlingantalspelareimatchtrupp": 18,
  "antalhalvlekar": 2,
  "tidperhalvlek": 45,
  "antalforlangningsperioder": 0,
  "tidperforlangningsperiod": 0,
  "liverapporteringTillaten": true,
  "liverapporteringPaborjad": false,
  "liverapporteringAvslutad": false,
  "liverapporteringsAktorTypId": 2,
  "anvanderspelarleg": false,
  "foreningsanvandarefarredigeramotstandartrupp": true,
  "foreningsanvandarefarregistreramatchhandelser": false,
  "foreningsanvandarefarregistreramatchresultat": false,
  "domaruppdraglista": [
   {
    "domaruppdragid": 86000280,
    "matchid": 91000056,
    "matchnr": "990001002",
    "domarrollid": 1,
    "domarrollnamn": "Huvuddomare",
    "domarrollkortnamn": "Dom",
    "domareid": 82029,
    "domarnr": "970001",
    "personid": 8100017,
    "domaruppdragstatusid": 5,
    "domaruppdragstatusnamn": "Tilldelat",
    "personnamn": "Birgitta Stenstad",
    "namn": "Birgitta Stenstad"
   },
   {
    "domaruppdragid": 86000346,
    "matchid": 91000056,
    "matchnr": "990001002",
    "domarrollid": 2,
    "domarrollnamn": "Assisterande 1",
    "domarrollkortnamn": "AD1",
    "domareid": 82204,
    "domarnr": "970004",
    "personid": 8100639,
    "domaruppdragstatusid": 5,
    "domaruppdragstatusnamn": "Tilldelat",
    "personnamn": "Nore Sälgnäs",
    "namn": "Nore Sälgnäs"
   },
   {
    "domaruppdragid": 86000351,
    "matchid": 91000056,
    "matchnr": "990001002",
    "domarrollid": 3,
    "domarrollnamn": "Assisterande 2",
    "domarrollkortnamn": "AD2",
    "domareid": 82259,
    "domarnr": "970005",
    "personid": 8100679,
    "domaruppdragstatusid": 5,
    "domaruppdragstatusnamn": "Tilldelat",
    "personnamn": "Nore Rönnudde",
    "namn": "Nore Rönnudde"
   }
  ],
  "domarefargodkannarapport": false,
  "domarrapporteringTillaten": false,
  "noteringfranlag1": "",
  "noteringfranlag2": "",
  "noteringfrandomare": "",
  "tavlingFriaByten": false,
  "tavlingDomareMojliggorHamtningAvFrammandeSpelareTillMatchtrupp": true,
  "tavlingAntalTimmarInnanMatchForTruppAdministration": 45,
  "tavlingDomareKravForekomstAvAnsvarigLagledareIGodkandDomarrapport": true,
  "tavlingAntalDagarEfterMatchForAdministrationAvDomarrapport": 1,
  "tavlingKonId": 2,
  "tavlingAlderskategori": 4,
  "kontaktpersoner": [
   {
    "lagid": 930240,
    "lagnamn": "Lag G IF",
    "personid": 8100750,
    "personnamn": "Kettil Myrfors",
    "reserv": false,
    "foreningId": 94098
   },
   {
    "lagid": 930240,
    "lagnamn": "Lag G IF",
    "personid": 8100772,
    "personnamn": "Ärna Rönnboda",
    "reserv": true,
    "foreningId": 94098
   },
   {
    "lagid": 930289,
    "lagnamn": "Lag H BK",
    "personid": 8100789,
    "personnamn": "Eldrid Lindsand",
    "reserv": false,
    "foreningId": 94131
   }
  ],
  "matchlag1OffentliggorMatchtruppDatumTid": "/Date(1639486800000)/",
  "matchlag2OffentliggorMatchtruppDatumTid": "/Date(1639486800000)/",
  "tavlingDomareAntalMinuterForeMatchSomTrupperOffentliggors": 45,
  "domareArHuvuddomare": true,
  "tavlingMatchklimatDomareKanLamnaOmdome": false,
  "tavlingDomareVisaVarningsOchAvstangningsAckumulering": true,
  "TavlingTrojnummerKravsIForeningensLaguppstallning": false
 }
]
