[
 {
  "__type": "Svenskfotboll.Fogis.Web.FogisMobilDomarKlient.MatchJSON",
  "value": "990007001",
  "label": "990007001: Lag Y IF - Lag Z BK (Serie 8), 2023-08-05 19:30",
  "matchid": 91000294,
  "matchnr": "990007001",
  "fotbollstypid": 1,
  "matchlag1id": 92000614,
  "lag1lagengagemangid": 9500632,
  "lag1lagid": 930694,
  "lag1foreningid": 94586,
  "lag1forbundid": 0,
  "lag1namn": "Lag Y IF",
  "lag1spelsystem": "0",
  "matchlag2id": 92000711,
  "lag2lagengagemangid": 9500729,
  "lag2lagid": 930788,
  "lag2foreningid": 94595,
  "lag2forbundid": 0,
  "lag2namn": "Lag Z BK",
  "lag2spelsystem": "0",
  "anlaggningid": 98273,
  "anlaggningnamn": "Spelplats 8",
  "anlaggningLatitud": -1.7976931348623157e+308,
  "anlaggningLongitud": -1.7976931348623157e+308,
  "tid": "/Date(1691256600000)/",
  "speldatum": "2023-08-05",
  "avsparkstid": "19:30",
  "tidsangivelse": "2023-08-05, 19:30",
  "tavlingid": 960292,
  "tavlingnr": "990007",
  "tavlingnamn": "Serie 8",
  "tavlingskategoriid": 97103,
  "tavlingskategorinamn": "Kategori 4",
  "tavlingagsavforbundid": 102,
  "matchlag1mal": 1,
  "matchlag2mal": 0,
  "arslutresultat": true,
  "wo": false,
  "ow": false,
  "ww": false,
  "antalaskadare": 0,
  "uppskjuten": false,
  "avbruten": false,
  "installd": false,
  "matchrapportgodkandavdomare": true,
  "matchrapportgodkandavdomaredatum": "/Date(1691273398520)/",
  "matchrapportgodkandavdomaredatumformaterad": "2023-08-06 00:09:58",
  "tavlinganvanderhogupplosttid": false,
  "tavlingantalstartadespelareigodkanddomarrapport": 11,
  "tavlingmaxantalspelareimatchtruppigodkanddomarrapport": 18,
  "tavlingantalledareimatchtrupp": 7,
  "tavlingantalspelareimatchtrupp": 18,
  "antalhalvlekar": 2,
  "tidperhalvlek": 45,
  "antalforlangningsperioder": 0,
  "tidperforlangningsperiod": 0,
  "liverapporteringTillaten": true,
  "liverapporteringPaborjad": false,
  "liverapporteringAvslutad": false,
  "liverapporteringsAktorTypId": 2,
  "anvanderspelarleg": false,
  "foreningsanvandarefarredigeramotstandartrupp": true,
  "foreningsanvandarefarregistreramatchhandelser": false,
  "foreningsanvandarefarregistreramatchresultat": false,
  "domaruppdraglista": [
   {
    "domaruppdragid": 86001228,
    "matchid": 91000294,
    "matchnr": "990007001",
    "domarrollid": 1,
    "domarrollnamn": "Huvuddomare",
    "domarrollkortnamn": "Dom",
    "domareid": 82029,
    "domarnr": "970001",
    "personid": 8100017,
    "domaruppdragstatusid": 5,
    "domaruppdragstatusnamn": "Tilldelat",
    "personnamn": "Birgitta Stenstad",
    "namn": "Birgitta Stenstad"
   },
   {
    "domaruppdragid": 86001272,
    "matchid": 91000294,
    "matchnr": "990007001",
    "domarrollid": 2,
    "domarrollnamn": "Assisterande 1",
    "domarrollkortnamn": "AD1",
    "domareid": 82759,
    "domarnr": "970017",
    "personid": 8103576,
    "domaruppdragstatusid": 5,
    "domaruppdragstatusnamn": "Tilldelat",
    "personnamn": "Orvar Granhage",
    "namn": "Orvar Granhage"
   },
   {
    "domaruppdragid": 86001331,
    "matchid": 91000294,
    "matchnr": "990007001",
    "domarrollid": 3,
    "domarrollnamn": "Assisterande 2",
    "domarrollkortnamn": "AD2",
    "domareid": 82778,
    "domarnr": "970018",
    "personid": 8103603,
    "domaruppdragstatusid": 5,
    "domaruppdragstatusnamn": "Tilldelat",
    "personnamn": "Majvor Videnäs",
    "namn": "Majvor Videnäs"
   }
  ],
  "domarefargodkannarapport": false,
  "domarrapporteringTillaten": false,
  "noteringfranlag1": "",
  "noteringfranlag2": "",
  "noteringfrandomare": "",
  "tavlingFriaByten": false,
  "tavlingDomareMojliggorHamtningAvFrammandeSpelareTillMatchtrupp": true,
  "tavlingAntalTimmarInnanMatchForTruppAdministration": 45,
  "tavlingDomareKravForekomstAvAnsvarigLagledareIGodkandDomarrapport": true,
  "tavlingAntalDagarEfterMatchForAdministrationAvDomarrapport": 4,
  "tavlingKonId": 2,
  "tavlingAlderskategori": 4,
  "kontaktpersoner": [
   {
    "lagid": 930694,
    "lagnamn": "Lag AA IK",
    "personid": 8103652,
    "personnamn": "Ivar Lövgärde",
    "reserv": false,
    "foreningId": 94586
   },
   {
    "lagid": 930788,
    "lagnamn": "Lag AB FF",
    "personid": 8103738,
    "personnamn": "Egil Lönnryd",
    "reserv": false,
    "foreningId": 94595
   },
   {
    "lagid": 930788,
    "lagnamn": "Lag AB FF",
    "personid": 8103764,
    "personnamn": "Frideborg Sälgtorp",
    "reserv": true,
    "foreningId": 94595
   }
  ],
  "matchlag1OffentliggorMatchtruppDatumTid": "/Date(1691253000000)/",
  "matchlag2OffentliggorMatchtruppDatumTid": "/Date(1691253000000)/",
  "tavlingDomareAntalMinuterForeMatchSomTrupperOffentliggors": 45,
  "domareArHuvuddomare": true,
  "tavlingMatchklimatDomareKanLamnaOmdome": false,
  "tavlingDomareVisaVarningsOchAvstangningsAckumulering": true,
  "TavlingTrojnummerKravsIForeningensLaguppstallning": false
 }
]
