[
 {
  "__type": "Svenskfotboll.Fogis.Web.FogisMobilDomarKlient.MatchJSON",
  "value": "990005001",
  "label": "990005001: Lag R FC  - Lag S IF  (Serie 6), 2022-07-08 14:00",
  "matchid": 91000168,
  "matchnr": "990005001",
  "fotbollstypid": 1,
  "matchlag1id": 92000506,
  "lag1lagengagemangid": 9500425,
  "lag1lagid": 930589,
  "lag1foreningid": 94474,
  "lag1forbundid": 0,
  "lag1namn": "Lag R FC ",
  "lag1spelsystem": "0",
  "matchlag2id": 92000585,
  "lag2lagengagemangid": 9500441,
  "lag2lagid": 930637,
  "lag2foreningid": 94486,
  "lag2forbundid": 0,
  "lag2namn": "Lag S IF ",
  "lag2spelsystem": "0",
  "anlaggningid": 98179,
  "anlaggningnamn": "Spelplats 6",
  "anlaggningLatitud": -1.7976931348623157e+308,
  "anlaggningLongitud": -1.7976931348623157e+308,
  "tid": "/Date(1657281600000)/",
  "speldatum": "2022-07-08",
  "avsparkstid": "14:00",
  "tidsangivelse": "2022-07-08, 14:00",
  "tavlingid": 960202,
  "tavlingnr": "990005",
  "tavlingnamn": "Serie 6",
  "tavlingskategoriid": 97133,
  "tavlingskategorinamn": "Kategori 5",
  "tavlingagsavforbundid": 105,
  "matchlag1mal": 1,
  "matchlag2mal": 1,
  "arslutresultat": true,
  "wo": false,
  "ow": false,
  "ww": false,
  "antalaskadare": 0,
  "uppskjuten": false,
  "avbruten": false,
  "installd": false,
  "matchrapportgodkandavdomare": true,
  "matchrapportgodkandavdomaredatum": "/Date(1657453735800)/",
  "matchrapportgodkandavdomaredatumformaterad": "2022-07-10 13:48:55",
  "tavlinganvanderhogupplosttid": false,
  "tavlingantalstartadespelareigodkanddomarrapport": 11,
  "tavlingmaxantalspelareimatchtruppigodkanddomarrapport": 18,
  "tavlingantalledareimatchtrupp": 7,
  "tavlingantalspelareimatchtrupp": 20,
  "antalhalvlekar": 2,
  "tidperhalvlek": 45,
  "antalforlangningsperioder": 0,
  "tidperforlangningsperiod": 0,
  "liverapporteringTillaten": true,
  "liverapporteringPaborjad": false,
  "liverapporteringAvslutad": false,
  "liverapporteringsAktorTypId": 0,
  "anvanderspelarleg": false,
  "foreningsanvandarefarredigeramotstandartrupp": true,
  "foreningsanvandarefarregistreramatchhandelser": false,
  "foreningsanvandarefarregistreramatchresultat": false,
  "domaruppdraglista": [
   {
    "domaruppdragid": 86000978,
    "matchid": 91000168,
    "matchnr": "990005001",
    "domarrollid": 1,
    "domarrollnamn": "Huvuddomare",
    "domarrollkortnamn": "Dom",
    "domareid": 82029,
    "domarnr": "970001",
    "personid": 8100017,
    "domaruppdragstatusid": 5,
    "domaruppdragstatusnamn": "Tilldelat",
    "personnamn": "Birgitta Stenstad",
    "namn": "Birgitta Stenstad"
   },
   {
    "domaruppdragid": 86001061,
    "matchid": 91000168,
    "matchnr": "990005001",
    "domarrollid": 2,
    "domarrollnamn": "Assisterande 1",
    "domarrollkortnamn": "AD1",
    "domareid": 82680,
    "domarnr": "970013",
    "personid": 8102532,
    "domaruppdragstatusid": 5,
    "domaruppdragstatusnamn": "Tilldelat",
    "personnamn": "Disa Lindlycka",
    "namn": "Disa Lindlycka"
   },
   {
    "domaruppdragid": 86001155,
    "matchid": 91000168,
    "matchnr": "990005001",
    "domarrollid": 3,
    "domarrollnamn": "Assisterande 2",
    "domarrollkortnamn": "AD2",
    "domareid": 82708,
    "domarnr": "970014",
    "personid": 8102564,
    "domaruppdragstatusid": 5,
    "domaruppdragstatusnamn": "Tilldelat",
    "personnamn": "Kettil Allid",
    "namn": "Kettil Allid"
   }
  ],
  "domarefargodkannarapport": false,
  "domarrapporteringTillaten": false,
  "noteringfranlag1": "",
  "noteringfranlag2": "",
  "noteringfrandomare": "",
  "tavlingFriaByten": false,
  "tavlingDomareMojliggorHamtningAvFrammandeSpelareTillMatchtrupp": true,
  "tavlingAntalTimmarInnanMatchForTruppAdministration": 0,
  "tavlingDomareKravForekomstAvAnsvarigLagledareIGodkandDomarrapport": false,
  "tavlingAntalDagarEfterMatchForAdministrationAvDomarrapport": 3,
  "tavlingKonId": 2,
  "tavlingAlderskategori": 4,
  "kontaktpersoner": [
   {
    "lagid": 930589,
    "lagnamn": "Lag T BK",
    "personid": 8102579,
    "personnamn": "Frideborg Bäckmo",
    "reserv": false,
    "foreningId": 94474
   },
   {
    "lagid": 930637,
    "lagnamn": "Lag U IK",
    "personid": 8102642,
    "personnamn": "Nanna Myrfors",
    "reserv": false,
    "foreningId": 94486
   },
   {
    "lagid": 930637,
    "lagnamn": "Lag U IK",
    "personid": 8102692,
    "personnamn": "Ottilia Lövåkulla",
    "reserv": true,
    "foreningId": 94486
   }
  ],
  "matchlag1OffentliggorMatchtruppDatumTid": "/Date(1657278000000)/",
  "matchlag2OffentliggorMatchtruppDatumTid": "/Date(1657278000000)/",
  "tavlingDomareAntalMinuterForeMatchSomTrupperOffentliggors": 60,
  "domareArHuvuddomare": true,
  "tavlingMatchklimatDomareKanLamnaOmdome": false,
  "tavlingDomareVisaVarningsOchAvstangningsAckumulering": true,
  "TavlingTrojnummerKravsIForeningensLaguppstallning": false
 }
]
