[
 {
  "__type": "Svenskfotboll.Fogis.Web.FogisMobilDomarKlient.MatchJSON",
  "value": "990009003",
  "label": "990009003: Lag I IK - Lag AR BK (Serie 15), 2023-10-06 13:00",
  "matchid": 91000635,
  "matchnr": "990009003",
  "fotbollstypid": 1,
  "matchlag1id": 92001232,
  "lag1lagengagemangid": 9501487,
  "lag1lagid": 931276,
  "lag1foreningid": 94184,
  "lag1forbundid": 0,
  "lag1namn": "Lag I IK",
  "lag1spelsystem": "0",
  "matchlag2id": 92001257,
  "lag2lagengagemangid": 9501580,
  "lag2lagid": 931280,
  "lag2foreningid": 95196,
  "lag2forbundid": 0,
  "lag2namn": "Lag AR BK",
  "lag2spelsystem": "0",
  "anlaggningid": 98588,
  "anlaggningnamn": "Spelplats 14",
  "anlaggningLatitud": -1.7976931348623157e+308,
  "anlaggningLongitud": -1.7976931348623157e+308,
  "tid": "/Date(1696590000000)/",
  "speldatum": "2023-10-06",
  "avsparkstid": "13:00",
  "tidsangivelse": "2023-10-06, 13:00",
  "tavlingid": 960654,
  "tavlingnr": "990009",
  "tavlingnamn": "Serie 15",
  "tavlingskategoriid": 97064,
  "tavlingskategorinamn": "Kategori 1",
  "tavlingagsavforbundid": 102,
  "matchlag1mal": 2,
  "matchlag2mal": 2,
  "arslutresultat": true,
  "wo": false,
  "ow": false,
  "ww": false,
  "antalaskadare": 0,
  "uppskjuten": false,
  "avbruten": false,
  "installd": false,
  "matchrapportgodkandavdomare": true,
  "matchrapportgodkandavdomaredatum": "/Date(1696838519487)/",
  "matchrapportgodkandavdomaredatumformaterad": "2023-10-09 10:01:59",
  "tavlinganvanderhogupplosttid": false,
  "tavlingantalstartadespelareigodkanddomarrapport": 11,
  "tavlingmaxantalspelareimatchtruppigodkanddomarrapport": 18,
  "tavlingantalledareimatchtrupp": 7,
  "tavlingantalspelareimatchtrupp": 18,
  "antalhalvlekar": 2,
  "tidperhalvlek": 45,
  "antalforlangningsperioder": 0,
  "tidperforlangningsperiod": 0,
  "liverapporteringTillaten": true,
  "liverapporteringPaborjad": false,
  "liverapporteringAvslutad": false,
  "liverapporteringsAktorTypId": 2,
  "anvanderspelarleg": false,
  "foreningsanvandarefarredigeramotstandartrupp": true,
  "foreningsanvandarefarregistreramatchhandelser": false,
  "foreningsanvandarefarregistreramatchresultat": false,
  "domaruppdraglista": [
   {
    "domaruppdragid": 86002428,
    "matchid": 91000635,
    "matchnr": "990009003",
    "domarrollid": 1,
    "domarrollnamn": "Huvuddomare",
    "domarrollkortnamn": "Dom",
    "domareid": 82029,
    "domarnr": "970001",
    "personid": 8100017,
    "domaruppdragstatusid": 5,
    "domaruppdragstatusnamn": "Tilldelat",
    "personnamn": "Birgitta Stenstad",
    "namn": "Birgitta Stenstad"
   },
   {
    "domaruppdragid": 86002480,
    "matchid": 91000635,
    "matchnr": "990009003",
    "domarrollid": 2,
    "domarrollnamn": "Assisterande 1",
    "domarrollkortnamn": "AD1",
    "domareid": 83283,
    "domarnr": "970031",
    "personid": 8106958,
    "domaruppdragstatusid": 5,
    "domaruppdragstatusnamn": "Tilldelat",
    "personnamn": "Personuppgifter Skyddade",
    "namn": "Personuppgifter Skyddade"
   },
   {
    "domaruppdragid": 86002508,
    "matchid": 91000635,
    "matchnr": "990009003",
    "domarrollid": 3,
    "domarrollnamn": "Assisterande 2",
    "domarrollkortnamn": "AD2",
    "domareid": 83310,
    "domarnr": "970032",
    "personid": 8107025,
    "domaruppdragstatusid": 5,
    "domaruppdragstatusnamn": "Tilldelat",
    "personnamn": "Ärna Häggnäs",
    "namn": "Ärna Häggnäs"
   }
  ],
  "domarefargodkannarapport": false,
  "domarrapporteringTillaten": false,
  "noteringfranlag1": "",
  "noteringfranlag2": "",
  "noteringfrandomare": "",
  "tavlingFriaByten": false,
  "tavlingDomareMojliggorHamtningAvFrammandeSpelareTillMatchtrupp": true,
  "tavlingAntalTimmarInnanMatchForTruppAdministration": 45,
  "tavlingDomareKravForekomstAvAnsvarigLagledareIGodkandDomarrapport": true,
  "tavlingAntalDagarEfterMatchForAdministrationAvDomarrapport": 1,
  "tavlingKonId": 2,
  "tavlingAlderskategori": 4,
  "kontaktpersoner": [
   {
    "lagid": 931276,
    "lagnamn": "Lag AS IK",
    "personid": 8107028,
    "personnamn": "Lovisa Mossaryd",
    "reserv": false,
    "foreningId": 94184
   },
   {
    "lagid": 931276,
    "lagnamn": "Lag AS IK",
    "personid": 8107047,
    "personnamn": "Hjördis Hasselsand",
    "reserv": true,
    "foreningId": 94184
   },
   {
    "lagid": 931280,
    "lagnamn": "Lag AR BK",
    "personid": 8107093,
    "personnamn": "Dunder Myrlycka",
    "reserv": false,
    "foreningId": 95196
   }
  ],
  "matchlag1OffentliggorMatchtruppDatumTid": "/Date(1696586400000)/",
  "matchlag2OffentliggorMatchtruppDatumTid": "/Date(1696586400000)/",
  "tavlingDomareAntalMinuterForeMatchSomTrupperOffentliggors": 45,
  "domareArHuvuddomare": true,
  "tavlingMatchklimatDomareKanLamnaOmdome": false,
  "tavlingDomareVisaVarningsOchAvstangningsAckumulering": true,
  "TavlingTrojnummerKravsIForeningensLaguppstallning": false
 }
]
